{"botName": "HotelBooking", "intents": [{"patterns": ["Hi there", "How are you", "Is anyone there?", "Hey", "Hello", "Good day"], "journeyName": "greeting"}, {"patterns": ["Bye", "See you later", "Goodbye", "Nice chatting to you, bye", "Till next time"], "journeyName": "goodbye"}, {"patterns": ["How you could help me?", "What you can do?", "What help you provide?", "How you can be helpful?", "What support is offered"], "journeyName": "options"}], "ner": [], "journey": [{"journeyName": "greeting", "blocks": [{"blockSeq": 1, "blockName": "wish", "type": "output", "getVariables": [], "inputMapping": [], "rules": {}, "api": {"apiType": "", "endpoint": "", "params": [{"key": "", "value": ""}], "dataMapping": {}, "outputMapping": {}}, "output": {"message": {"messageId": "greet1", "messageText": "Hello there", "messageType": "plaintext", "attachments": [{"attachmentId": null, "atachmentSeq": null, "attachmentDesc": null, "attachmentType": null, "options": []}]}}, "setVariables": [], "next": []}]}, {"journeyName": "goodbye", "blocks": [{"blockSeq": 1, "blockName": "wish", "type": "output", "getVariables": [], "inputMapping": [], "rules": {}, "api": {"apiType": "", "endpoint": "", "params": [{"key": "", "value": ""}], "dataMapping": {}, "outputMapping": {}}, "output": {"message": {"messageId": "bye1", "messageText": "Thanks, see you soon!", "messageType": "plaintext", "attachments": [{"attachmentId": null, "atachmentSeq": null, "attachmentDesc": null, "attachmentType": null, "options": []}]}}, "setVariables": [], "next": []}]}, {"journeyName": "options", "blocks": [{"blockSeq": 1, "blockName": "listofservices", "type": "output", "getVariables": [], "inputMapping": [], "rules": {}, "api": {"apiType": "", "endpoint": "", "params": [{"key": "", "value": ""}], "dataMapping": {}, "outputMapping": {}}, "output": {"message": {"messageId": "options1", "messageText": "I can assist in booking rooms at our chain of hotels", "messageType": "plaintext", "attachments": [{"attachmentId": null, "atachmentSeq": null, "attachmentDesc": null, "attachmentType": null, "options": []}]}}, "setVariables": [], "next": []}]}], "deploy": {"channel": "TKinter", "botControllerPort": "3000", "intentControllerPort": "3005"}}